id,Reviews
3824,还没有用，希望是正品，好的话还会继续买，用了在评论
3825,一分价钱一分货！特别的稀，上色效果一般，而且亮油也不好，涂完都乌乌的！有些失望，懒得退了！要求高的慎入
3826,已经用了，我是油性皮肤，比我以前用的洗面奶都舒服，第一次用这种的，特别好用，以后就先用这个了，
3827,不好，才用了几天就长脂肪粒了。哭泣
3828,感觉挺好用的，而且还很省，不用涂太多就可以，遮盖全脸。而且控油控的比较好
3829,还没用就已经断了
3830,滋润及保湿：不错
3831,好用  颜值也高不错
3832,面膜纸大小合适，很薄很水润，补水面膜我是天天贴，用一段时间看看效果，好的话用完会再回来的，客服服务态度也很好。
3833,用了好久了，这次活动给力 多买点
3834,应该是正品吧！买了几次了，洗的比较干净。
3835,清洁功效不错，很温和，味道也好闻
3836,太垃圾了，一点也没用，粘不下来。还不如我买的蜡自己脱呢？
3837,洗面奶收到了物流又快，试了一下感觉很好，润滑皮肤。习惯好评
3838,等了十来天才收到货，拆开快递瓶子都碎了，心情够郁闷，拿快递还要了两块钱，太坑了
3839,很不错，喜欢！搭配着买的，搞活动很合适
3840,超级难用！！！！上妆超级差，#，。很想退，但是开了封不能退。再#也不买了
3841,包装挺好的，拿回来用了一下效果挺好，夏天蚊虫比较多，这回放心多了 价格合理
3842,跟实体店一样的，关键是还送了两瓶甲油，我皮肤偏黄，选了紫色，试用了一下，不油，特别喜欢
3843,粉质不够细，使用不够服帖，味道还蛮喜欢，提亮的效果也不错
3844,非常好用，用后不干燥，滑滑的，气味很香
3845,一直用，做为日常护理很赞，温和无刺激，至从用了皮肤没有出现过什么问题！特别是冬秋天对我来说特别好用！
3846,个人情况：33 以前没有固定的用一个品牌  整体描述：总体来说还不错！这款有点小贵。
3847,使用效果：很好用
3848,一直回购的一个美白精华，好用
3849,面膜颜值还是很不错。水分也蛮多
3850,还没用，但是用他家的BB霜特别好用，隔离应该也不会差吧
3851,属实是不好用啊，刚开封就感觉干了
3852,妈耶，超级小巧，手上试用了一下易拍开，拍开后超级干爽，还防水，总体满意
3853,这个吧，活动时候挺合适的，不错啊，好用，买了好多了
3854,做活动买的，还是很划算的，但是就是面膜纸的孔都很大，贴着都不好看，还好精华很多。
3855,还没用，感觉还不错吧，之前没有用过，这次做活动几天买了两包试试
3856,用起来很顺手，刀片很快，用的时候要注意 
3857,很好不错非常喜欢下次再买
3858,客服态度不好。问问题也不回答。
3859,真的痛，黑头去不掉
3860,好用，水水的，粉很细，推荐
3861,买给妹妹的生日礼物女生都很喜欢会继续支持下去的
3862,跟一次性没啥区别。 刀片一点不锋利
3863,东西挺好的，媳妇很喜欢
3864,一般，没什么特别感觉，用用也行，价格便宜
3865,一直用这个牌子，一如既往的好~~
3866,一直都用****上年開始用這套大紅瓶感覺比之前的都好用，現在第二套
3867,隔离霜不错，一直在用，送货很快
3868,过节了，让自己更年轻，非常好。
3869,水分多，好吸收，不错
3870,不错是正品，价格有优势，快递也很给力，以后会继续购买
3871,这款隔离霜不错，一直都在用
3872,一直在用，618活动囤货，包装很好，物流快
3873,擦在脸上不泛白，不是特别油腻，还可以。防晒效果有待观察。
3874,用了一段时间了，感觉很不错哦
3875,东西很好，很好用
3876,味道很大，亮油一上就能把指甲油擦掉，不知道还以为是卸甲油
3877,挺好用的，不错
3878,太容易断了！刚拧出来就断了！！！想给差评
3879,有点小～但是很好用  送的东西也很nice
3880,整体描述：超级晕染，一点不好用 
3881,一直在这家买，用起没问题，这款水很清爽，不粘稠，喜欢用这款
3882,一般吧，有点干，不是很容易推开，有点假白，这个价位，我觉得还行
3883,个人情况：很喜欢，特别小巧，好用，好用，推荐，下次还来光顾！ 
3884,给我儿子买的，这小子现在满脸的痘痘，洗面奶到了孩子就用了，说是感觉挺好，味道也好闻，等着看效果
3885,上妆效果：一直比这个隔离霜，很好用！
3886,真的好用。夏天很合适。秒杀大牌
3887,味道很舒服，不腻，在脸上不搓灰，蛮好的
3888,奈斯，反正就是很好，老顾客了
3889,感觉应该是正品，送的按摩仪很好用，第一次使用时确实有发热的感觉，会坚持到底的，希望有用的，会追评的！
3890,已经买了好多好多次了，挺好用的。物流超快的。
3891,喜欢得不得了
3892,价格优惠，东西挺好，很喜欢
3893,收到宝贝了 包装很严实 质量不错 个人推荐值得入手
3894,产品好是好，就是快递途中一盒包装盒被压开了，一盒压扁了，如果包上气泡袋应该不会这样
3895,收到试用了一下，非常清爽
3896,妈呀，可以说十分划算了！！看着小样十分过瘾哈哈哈
3897,满满的酒精味道，还刺鼻
3898,很好推开，颜色也正合适，用送的卸妆液卸下来很方便
3899,最近一直用***觉得很好用
3900,不知道是第几次购买了，妈妈的化妆品一直都在他家购买，真的不错，喜欢的朋友可以放心购买了。
3901,特别好用 比实体店便宜一点点
3902,很喜欢 以多次购买
3903,补水效果：一直在他家买***的面膜，发货速度很快的，推荐。希望下次能多多优惠。。
3904,一收到宝贝就试了一下，特别好
3905,不是很好用，卸得不是很干净，虽然很大一瓶，可是卸不干净，浪费了，卸口红要卸很多次才可以
3906,挺好用的，下次还买
3907,洗面奶很清新，味道很好闻
3908,补水效果真的很不错 朋友推荐的
3909,还不错😊
3910,是正品，用过后感觉不错，会一直用下去
3911,上午买的 下午就到了**快递速度真不是盖的这是买的第一个隔离霜 希望好用吧
3912,第几次买了 很好
3913,以为就一个替换装，没想到有两个，马上试用了，妆容超级服帖，很喜欢很喜欢
3914,用着效果蛮好的，相信***，一直都用它
3915,挺水的，不卡粉不油腻。
3916,宝贝收到了，用了几片，没让我失望，感觉和实体店的效果一样的，价格实惠👍👍👍用完之后还会再来
3917,用了一下，还不错
3918,不好，不会回购了
3919,刚开始使用，挺滋润的，用了后感觉皮肤嫩滑滑的，淡斑的话还没感觉出来，毕竟才开始用，后续再来追评
3920,挺好 帮人买了很多次了
3921,真好看
3922,一直用这款还是比较信赖的
3923,非常好用很好
3924,很好用，滋润不油腻不紧绷，喜欢
3925,超级好用
3926,自然，不油腻
3927,头皮屑比较多
3928,宝贝收到啦，包装完整，洗面奶很好用，温和不刺激，还有赠品送哦
3929,挺好的吧  第一次用气垫
3930,不好，刷上很久了眨眼睛还是会晕染，贼难看
3931,发货物流都蛮快，东西还没用，我油皮，买的干皮适用的凑单买的，不知道好用不
3932,亮片都掉了，颜色也不符
3933,超级假的感觉。
3934,个人情况：27 吸收情况：易吸收 整体描述：包装不错 滋润及保湿：保湿  不是很滋润
3935,收到了还不错 发货也快  就是我睫毛太短了😂
3936,油皮的亲妈啊，强烈推荐，比**控油好太多了，遮瑕力也超级好，真的比大牌还要好用
3937,这些一直都在柜台买，宁愿多掏点钱也不相信**，这次买的东西回来查了都是正品，便宜又实惠，还会经常回购
3938,包装不好都出来了
3939,价格实惠 期待能变白 油性皮肤用也挺水润的 不油腻 好评
3940,要买白一号的整体不错
3941,洗面奶用的时候泡泡细腻丰富，有一股淡淡的香味，用完后清爽舒适，洗得很干净，用完没有不舒适的感觉，还会再买！
3942,不知道该怎么说，我用着会辣眼睛疼
3943,假货假货假货！！！跟我从泰国买回来的味道包装完全不一样
3944,em...无话可说
3945,朋友推荐的，等用段时间在给追加！先给个5星好评！
3946,挺好的吧感觉 还没有用
3947,很好用，建议购买哟
3948,这是第三次买了保湿效果不错，这次还送了盒子，谢谢老板
3949,满满一大盒 包装颜值超级高 期待用起来的效果～**的物流真的超级快～太满意了～
3950,应该还好
3951,物超所值，棒棒哒
3952,一点都不好 质量太差 里面有杂质
3953,洗面奶用了下泡沫很丰富细腻，洗的很干净，还送了除螨皂！
3954,想要这个眼影盘很久了，终于到手，超级喜欢
3955,面膜感觉不错，价格实惠，值得购买，不错的一次购物，下次还会光临
3956,昨天晚上下单今天中午就收到了货，**很给力，先用用看，希望再次光临
3957,非常平价的面膜了，补水不错
3958,物流快递差到极点、到了两天没给我找到、还显示签收 
3959,一直关注的，活动期间买的，颜色很自然，一个两个替换装喜欢
3960,油性皮肤用了效果很好，用完了还会购买
3961,挺润的，油皮不推荐
3962,出乎意料的好哦，很衬肤色，味道也好
3963,宝贝太漂亮了
3964,用了几天，效果还行，挺保湿的，
3965,宝贝收到了，很满意，已经是回头客了，很喜欢这款面膜，补水效果也很好，价格实惠又好用
3966,面肤很贴肤，很舒服，特意试了几天才评价，跟想相的一样，扫了一下是正品，想要补水的朋友是个不错的选择
3967,东西收到了，不错，是想象中的样子，有喜欢的可以购买哦😊
3968,存货，还没用，做活动买，还挺划算的。
3969,一转眉笔就断了算我倒霉9.9的东西，涨记性吧
3970,面膜很优惠，价格很美丽，质量很好！！
3971,很不错，第二次买了
3972,不好丢了
3973,非常好用，从下学就开始用，五年了，日常护肤面膜，防晒隔离，都是***的，就一款***的粉底液！
3974,用过很好！支持***买来送朋友！质量也很好！外包装也很卫生！? ? ?
3975,太小了，鼻子都遮不住，脸只能敷中间四周遮不到。
3976,买一送一这个价格差不多。相信品牌，还没使用
3977,很不错。不是特别显白，很自然的一款。大家可以放心购买。快递也超快。
3978,精华太少啦
3979,面膜还挺好用的特地用了几贴才来评价的
3980,收货迅速，不用等太久，叶藻的很保湿，配方最简单最保湿，墨角藻的黑面膜不行，水润面膜很粘不行
3981,很好用，很滋润，也不油腻挺清爽的
3982,物流很快，商品好。支持**。
3983,好用好用！混干皮略微有点干
3984,爱了爱了 试了一下很控油 色号真的是像专门定制一样 是很近肤色的色号 龙龙太帅了
3985,太难掰开了，特别香 ，物流啥的倒是特别快 可惜了我是蓝色了，看很多人是金色的 本来以为是金色的呢，
3986,不建议买，一点都不好用，用完了聊天脸上直接长闭口
3987,我真的表白了一丢丢，最主要618买好划算呀
3988,大油皮，用了几次感觉还不错，作为面霜对油皮算是非常友好啦～
3989,宝贝收到了不错，说以前用过。买了两套送两个面膜盒子，划算。
3990,给力，价格便宜，物流速度快，购物体验感好，我很喜欢
3991,没有刺激 客服清水超好噢 有耐心 送了洁面小样
3992,宝贝收到，我和女儿常年用这款产品，好！
3993,用了几天才来评价的，洗后不紧绷，还不错。至于粉刺和黑头，效果应该没这么快，过段时间再来追评。。
3994,大品牌值得信赖，**快递很快的
3995,物流很快，包装完好，心情美美的。活动价买的，多送了一个替换装
3996,涂上去干巴巴，不好，针对产品，实话实说。
3997,非常好用，推荐购买
3998,质量太差了 涂上去太软了 一碰就掉
3999,好像下错单了，早的不是这个肤色的，还送了一个置换装，不错不错
4000,味道太臭了
4001,非常棒是正品价格也是很奈斯了
4002,滋润及保湿：质地很适合夏天用，保湿不错，其他效果待关注
4003,看起来还不错，等用了再来评论吧
4004,挺好用的，没有味道不会刺激
4005,一直在用~很好
4006,质感一般
4007,没什么用吧很垃圾
4008,一直用的***护肤品，这个面膜用完皮肤很滑嫩，不刺激
4009,东西很好用么在买，买买买买
4010,宝贝收到了！效果很不错！我很喜欢😘
4011,还没用，喜欢这个牌子的化妆品，五分好评
4012,非常满意很欧美的感觉  睫毛根根分明好漂亮
4013,这个东西脱妆太严重了吧？尤其是下巴和鼻翼，难道需要打底什么的&hellip
4014,产品还不错，洗脸之后清清爽爽的
4015,买给婆婆用的 ，婆婆说很不错， 下次还会回购
4016,用的不错，给老婆买的
4017,好用，补水效果非常好，我是第三次买他家的了，以后继续购买
4018,使用效果：挺好的  用完脸滑滑的 也不干了比一叶子的好用
4019,都是气泡，服不？毕竟十来块的东西，也不能期望太高。。。生气的是物流，睡到路上啦
4020,用着这个东西还可以的，以后会继续使用，主要家里有人用过的，以后有活动还会继续的。。。
4021,洗脸舒服 活动价购买划算
4022,滋润及保湿：清爽无负担，适合我这种极度厌恶油腻的人，这个真是神器。
4023,很好很满意
4024,原本习惯自动好评的！卖家就这么磨磨唧唧实在太烦人了！必须差评，烦死了
4025,空气霜还没用，先用了送的***小样，果然是挺油腻的，偏油皮只好晚上用吧
4026,用了一次，太稀了，清洁效果感觉不如之前买的**，不过好在我皮肤是中性，清洁能力一般的也可以了，
4027,赠品多多，喜欢！上脸不油腻，棉绒感很舒服
4028,很好，下次还来
4029,洗面奶收到，买一送一，好!
4030,好用，性价比很高
4031,收到宝贝晚上就用一贴，面膜滋润，精华特别多，我是敏感肌肤还不知道会不会过敏，快递小哥态度很好
4032,送给妈妈的 还可以 不错的
4033,很贴合肤色，效果不错
4034,一直是***的忠实粉丝，也一直在这家店购买，绝对的正品，补水效果很好又刺激的，最爱***哦！
4035,面膜正在使用中，效果挺好的，会持续关注的
4036,没什么效果，根本没有推荐的那种效果
4037,给老婆买的!老婆说效果很好!
4038,用了2次不错，清洁的很干净
4039,质量不错的，帮朋友买的，比实体店便宜不少钱的呀
4040,好用，适合我
4041,一直用这个牌子的。很喜欢，
4042,不错，包装精美，日期新鲜，有遮瑕效果&hellip
4043,还挺滋润的吧，我皮肤比较干，。送的面膜很服帖，很滋润，下次会考虑用这个品牌的面膜
4044,收到还没开始用，但是闻着味道还不错
4045,好好用，很方便，**品质，值得信赖。
4046,看着还不错 就是包装有点简陋 试了再追评
4047,好，不错价格实惠物流快666666
4048,防晒效果：还可以 看着不错。
4049,整体描述：宝贝收到了，回来就试了试，还真的好用，脸洗的很清透，我是油性皮肤
4050,好用、非常喜欢、可以购买、
4051,太垃圾了 一点都不快
4052,个人情况：满意
4053,上脸之后很滋润，而且不油腻，味道也比较好闻
4054,空气霜夏天用真是太好用了，跟精油一起用也不会油腻，夏天必备神器啊！会回购。
4055,真的巨难用 又痛又脱不了 鸡肋 别买
4056,宝贝收到了，回来就迫不及待的用了，泡沫丰富细腻，洗完不紧绷，非常喜欢，会再来的
4057,不错，喜欢！
4058,本人大油皮，用着挺清爽的，有淡淡的酒精味，但是不影响它好用，吸收得挺快，挺好的。
4059,我滴天爷....摔一下就断了 而且还是从根部断的 我一次还没用 留下悔恨的泪水..太脆弱了吧
4060,物流慢死，付款8.9天才发货，买了几百块也没赠品
4061,买的超值，送了两贴面膜，还有两瓶卸妆水，发货快到过快，支持**没错的
4062,用着不错，感觉挺好，还在继续使用，
4063,收到货，还没用，应该不错的，味道很好闻，哈
4064,收到了，没有想象的那么好，很失望
4065,我皮肤偏白  但是额头有点发黄，用完太白了，涂的很少的一点点都不行
4066,还可以，很实惠！
4067,商品质量，物流时效人员服务都太棒啦！！！
4068,还没用就断了，差评！
4069,一直在用这个牌子，价格合适不错
4070,东西还是不错的，价格便宜，第3次购买，相当不错
4071,很香，加了香精
4072,这个眼影盘挺好的，用起来也好用，不卡粉，喜欢💕
4073,清爽不油腻，很喜欢，第二次买了，上次是3.8买的，上一罐刚好空瓶，完美连接。
4074,不好，用了也没有什么好的效果
4075,用了几天才来评价，真心不错直得购买
4076,都要差死了，颜色就像跟小孩子玩的一样
4077,狂欢价买好划算  期待使用
4078,宝贝以收到，因为以前用过几次感觉不错，就有买了23片请大家放心够买。
4079,图我都不想上了。真的是垃圾！超级难用！不知道怎么那么多好评！
4080,这个粉饼好用，送货快，包装盒完好，省时省力。
4081,非常满意的购物，我一直都用喜马拉雅面膜，效果特别好
4082,还行吧！一直用***产品。
4083,香香的的肌肤是***馈赠的
4084,好用，很保湿，擦了几天感觉还蛮适合我的。还送了洗面奶和小样，好评
4085,用了送的小样，吸收很快，清爽不油腻，很棒。送的东西也很棒了
4086,太干了，脸颊抹完了起皮，确实比较适合过敏的人，比觉清爽但是不保湿呀
4087,这款防晒真的很好！无限回购
4088,包装盒很好看，送有两个替换装，粉质很是细腻，略带香味，用着很舒服！
4089,用了499-100的优惠券，买了2瓶眼霜和一瓶洗面奶，加起来应该才320写完，好划算了
4090,便宜又好用，价格实惠，好评
4091,第一次在**上买东西，包装完好时间也快
4092,上妆效果：哑光的很好
4093,宝贝不错，明天都在用的产品哦
4094,现在用的全部是这个产品，就不晒图了，我用这个好用，也还我妈妈买了，都说好用，还回光顾的
4095,清洁能力：清洁效果挺不错的 很大一支 比较稀
4096,优惠活动时买的，性价比较高，以后还会回购
4097,好评，效果很好，老婆很喜欢。
4098,遮瑕力和持久力都不错，不怎么会脱妆，油皮夏天用很好
4099,东西很不错，给老婆买的，希望老婆能喜欢！
4100,香香的，挺舒服的
4101,宝贝很好用，很温和，小仙女们值得入手哦！
4102,物流是还行，就是用起来似乎不太好，哎！还是不合适自己吗？
4103,每天需要化妆，买了很多卸妆水都不行。只有这款卸妆水很好用，清爽不刺激。
4104,感觉没用  用完后脸上有点油  可能是我肤质不对  我是混合性皮肤
4105,自己做的，颜色没什么色差 很好看。
4106,用着还可以，冬天用保湿效果还不够
4107,双十一很划算，物流也很给力
4108,隔离防晒霜正品，我己经用过了，很好用，非常适合干燥缺水的皮肤，用完以后皮肤水润白皙，很自然。
4109,一股廉价的香精味，很浓
4110,物流还不错，小哥服务态度好
4111,之前买过，这个没用呢，应该可以
4112,混油皮，控油遮瑕效果不错
4113,用完皮肤比较干，好像不是正品，没有想象中的好
4114,干皮用着非常舒服，洗完不会特别拔干。
4115,多次购买了，感谢做活动这么便宜，以后双十一还来买，效果好，虽然没有美白，夏天没变黑球，就很好了
4116,洗面奶泡沫细腻很好清洗，洗的很干净，卖家服务态度很好，物流也很快
4117,可以，挺有用的，酸爽
4118,东西挺好的喜欢的可以买
4119,洗面奶温和不刺激，洁面很干净，易清洗，补水效果棒棒哒，五星好评
4120,很好用哦！还送了那么多赠品，谢谢老板哈
4121,很好用，很自然，看起来而且很滋润，用了之后觉得皮肤还是挺好的，挺细腻的。
4122,一直用的这个牌子的面膜，真的不错哦！
4123,不错，好用
4124,女朋友说用着还不错
4125,已经第二次购买了，使用下来感觉蛮好！
4126,盒子太小，快递已丢失，没多少钱，就算了
4127,过于细了  然后棕色不好上色还那么细  真的是差评了
4128,喜欢，刚到就敷了一次，精华也很多，很适合干皮的妹妹
4129,过于辣鸡 都断了怎么用
4130,宝贝收到，用感觉还行，就是有点稀。发货很快，包装完好，给予好评。
4131,挺好的，精华液很多
4132,效果很明显，不过敏，好用，和卖家说的一样好用！值得购买！
4133,618超级无敌划算又好用啊，太太太太爱了，会一直使用哒💯💯💯
4134,好用，还会回购的。
4135,洗面奶非常棒，洗完以后脸不干，很细腻。
4136,不错，很好用
4137,618搞活动，囤的啦，哈哈，不错不错，优惠力度很大
4138,清爽，适合夏天用，先囤货
4139,"用后来评价的,清爽好吸收，之前买过一瓶，没有用完，接下去会坚持用，期待淡斑"
4140,差评，不好用
4141,化妆水好像和以前不太一样，这次的非常清爽，一样能一样好用。
4142,昨天晚上购买今天早上就到手了物流杠杠的。包装不错，就是不知道效果怎样?用了在来评价
4143,快递很给力，还有赠品，买得挺优惠的，用着还可以
4144,买给妈妈的  用了两天没有什么过敏反应  说还可以
4145,好很好非常好好得不得了！
4146,控油效果好，清洁很到位，还送了很多礼品。洗了脸完全不紧绷
4147,礼品很好哦
4148,还好吧，就用过一次，就是不知道是不是自己皮肤太干，有点脱皮的感觉，总体还可以的
4149,还不错，挺滋润。
4150,产品比想象中要好很多?**物流发货就是快，必须赞一个
4151,小小一只。目前用了还没感觉到明显变化， 如果以后有明显改善会来追评
4152,不好用，用了腋下红痒几天，夏天出汗泡伤口就好像盐泡到伤口一样疼，还脱的不干净。。。。。
4153,客服态度特别好，之前地址填错了赶在离开之前收到啦，非常感谢
4154,一直用的  不错
4155,质量非常差，一大股味道，很难闻，非常廉价的劣质产品，根本不能用，一次性买了很多后悔死，便宜没好货，大家千万不要买，不然你会哭死
4156,持续回购！祛新生痘印真的是很牛逼了。
4157,用着不错  期待变白
4158,给妈妈买的，妈妈挺喜欢的
4159,就是有点小贵
4160,还可以，就是不撑时间
4161,618买的，赠品很多，超开心
4162,很好。不错。
4163,一直用这品牌正品5分
4164,还没用 同系列的气垫超好用就入了这个 但是比这个包装 真的是 非常的简单了
4165,很一般 毛戳人得很。 懒得退了。真是很无语
4166,很喜欢很喜欢
4167,指甲油很好  我觉得很划算  平常做个指甲都要几百  这才几十  值得购买  就是味道有点大
4168,喜欢啊
4169,一个字小
4170,难用 别买  不能贪便宜
4171,第一次使用***系列的面膜，营养液很充足，敷玩脸还可以贴贴脖子，
4172,水分不是很足，，，
4173,不好用，没有描述的那么好，用了很明显的会有一块感觉没上好妆，妆感重，我还是油皮都驾驭不了，慎买
4174,包装完整，买了两盒，七五折，实惠。用过以后再来追评?。
4175,物流超快!用过后再来评价
4176,就是没有泡泡感觉洗的不是很干净
4177,发货很快 包装的也不错 没有什么损坏 买来尝试看看 对干皮算友好 很滋润 成膜速度一般 有轻微泛白的效果
4178,宝贝不错，很满意
4179,挺实惠的，用着也不错，以后就用这牌子的了，介绍给朋友来用
4180,搞活动买的 还是很划算 刚擦完会有点泛白 一会就好了 很滋润
4181,店家很有心，每个都包的很好，还送了小礼物，东西不错，看了好久才买的，用好了还会继续光顾的的？
4182,第一次感觉很好 还没有拆正装的空气霜 只用了小样 感觉第二天起来脸软软的 会回购
4183,用了过敏
4184,个人情况：用好了后面会追加评价 吸收情况：吸收很好！
4185,大容量，上脸酒精味比较大，成膜快，有点容易搓泥
4186,不错不错，好的好的，很不错
4187,很不好看，壳子还烂了
4188,用了，确认是正品，很好用，用后脸上爽爽的，感觉滑滑的，很舒服，黑头也少了些，好评！
4189,第二次购买了，温和卸妆无负担，卸眼妆都不会感觉刺激，也不干，卸的干净，量大耐用。挺喜欢的
4190,使用还可以，就是快递的包装怎么又是中空的，物品在里面来回跑，哗啦哗啦响
4191,女朋友很喜欢，下次再来
4192,一如既往的喜欢用
