id,Reviews
7231,东西不好用 还想骗人给好评发红包
7232,到货是一打开有股刺鼻的香味  感觉不是很好  看了有很多好评才买的
7233,满满一大盒( *&acute;&deg;`*)
7234,味道很好，挺不错的
7235,吸收情况：很好涂抹，不油很容易吸收
7236,大小刚好，水份足，皮肤白嫩
7237,收到了，不错哟
7238,宝贝很好，物流也很快，希望**越做越好，价格越来越便宜，**加油加油加油加油加油加油
7239,还可以吧一直在用
7240,昨天刚买，今天就降价了，垃圾
7241,挺不错的！挺好用 一直用这个洗面奶
7242,宝贝非常好用，不油腻，很清爽，大爱
7243,闺蜜推荐的，据说效果很不错，期待能有好的效果吧！
7244,眉刀一点都不锋利，眉刀都刮不干净
7245,不知道效果如何，感觉还不错
7246,只想说后悔没看差评， 收到用了之后后悔的一批，浮粉卡粉 不自然差差差
7247,还不错，还行可以用先用用看。好的话会继续来买。
7248,特别好用，
7249,一般般，感觉很干，抹不开，不服帖的感觉
7250,送了洗面奶，好迷你啊，防晒买给老公用。
7251,滋润及保湿：很不错，对混油皮很好，很喜欢这种空气感觉
7252,朋友推荐用的，还不错，喜欢百合补水面膜，挺好用的，补水效果挺不错，客服态度也挺好的
7253,东西收到了质量很好很好用，超级喜欢会继续关注
7254,挺好的，是正品
7255,宝贝不错，好评
7256,***太好用啦！囤货囤货
7257,收到宝贝还没有用，赠品很喜欢！客服态度很好，用了产品后再再来
7258,没想象的那么好 便宜没好货好货不便宜
7259,根本用不成！好评哪来的都？
7260,假的吧一点都不好用，之前那些人的评论不会也是作假的吧
7261,这个很好用，之前买过好几款都不太理想，这款用了很理想，泡泡很细，不紧绷，性价比又高，很喜欢
7262,差得不想说啥了
7263,刚刚收到用了一下  很好用的想再囤点涨价了?
7264,干得特别快，都没来得及刷完就干了，完全没法涂！！！味道也是太重了，那么多好评都是怎么来的？？。
7265,棒棒的
7266,活动买的，价格便宜，很好用，下次再买
7267,一如既往的好 用三个双十一了 跟实体店一样 每次都这样备一年的 超划算
7268,好好好好好好好好哈好好好好好好好好哈好好好好好啊好哦啊好哦啊好啊好好好啊好哦阿浩
7269,感觉墨角澡面膜面膜比较好用。
7270,材质一般，用了有小洞，总体还可以吧。
7271,还不错，价格合理，值得推荐
7272,东西很不错！手感特别好
7273,一直在用这个卸妆液，很清爽，不油腻，很喜欢，卸的也很干净
7274,平时用的较多这种面膜的宝宝，可以用买这个。很薄很好用。
7275,寄过来的什么鬼，香倒是挺香的，包装也不错，可是整个都碎到了，就当买个教训吧，先给个中评，之后看一下好不好用
7276,东西收到，效果一般，要类保湿的，用过后不保湿
7277,这个遮瑕效果一般
7278,洗面奶泡沫不多，洗了还比较干净，也不紧绷，现在换了整套***，总体来说还可以，发货挺快的，好评
7279,没小样，不开心
7280,还行，就是感觉能再便宜点就好了。
7281,宝贝不错👍怎么好好用的慢慢开发🤦&zwj;♀️
7282,买正装送了4个小样，还没用，小样14克，正好送给朋友们适用，好用会回购
7283,回购，喜欢！
7284,很劣质&hellip;一看就是假的，有很大的胶味儿
7285,第二次购买物美价廉
7286,还没用，应该不错吧
7287,颜色买深了，和其它粉调和一下用，不错，单用这个就觉得拔干，遮瑕一般！
7288,很好用，老顾客了
7289,价格很便宜，比我在实体店买的要优惠很多。
7290,真的很好用，精华液很多，也很实惠
7291,包装挺精致，期待效果！
7292,还好吧就是有点损坏了
7293,包裹超严实，然后粉底液很小巧，很小一只，试用了一下质地不错，特别自然，不仔细看完全看不出来差别
7294,老客户了，一直在你们家买，五星好评！
7295,味道难闻，收敛水用上去，刺激的特别疼
7296,挺好的 一直在用 很滋润
7297,气味不好，使用也不大好。
7298,感觉挺不错的~洗着也挺舒服~不刺激不紧绷~
7299,超好用！！使用感好，还能让脸一天不暗沉！双十一回购！
7300,一直用。很好，喜欢，还送了抱枕，挺好的，用完，在来买。呵呵，好评
7301,物流好快，已经收到了，试了一下还不错，很水润，喜欢的可以考虑
7302,实物与图片上一样，日期新鲜，看起来不错，正品保证
7303,第二次买了，好用，不会过敏
7304,隔离霜还没试，赠送面膜却是出奇好用啊。
7305,收到了好大一箱子精华很多
7306,不是正品  这个买过多次了
7307,宝贝已收到，眼观质量不错，颜色漂亮，昨天收到今天已用，很好，效果理想哦，值得推荐购买哦！
7308,宝贝收到了，非常好看，不墙白，颜色自然外壳好看，最重要的是峰峰代言的！！赞\(���)/
7309,感觉还不错，是正品，下次再买
7310,使用效果：这款洗面奶不错，洁面不紧绷
7311,我的妈呀，我太后悔了，说实话颜色都不好上色，还看那么多网红推荐，你这是假货吧
7312,无限回购了，便宜好用
7313,收到就用了，控油效果不错，黑头也明显改善了，继续使用，相信会有更好的效果
7314,这修眉刀真大真厉害  这怎么用
7315,很好用，补水效果挺好的
7316,赠品多多，一瓶空气霜赠了5个***小样，划算
7317,不油腻  清爽
7318,泡沫很细腻，柔和。还送了好多小样。是正品，特别满意。还会回购的。洗面奶被妈妈拿走了，先来个小样图片。
7319,还可以吧，效果和以前买的一样，就是包装和面膜纸有些变化，还是可以的。
7320,很不错包装也很好
7321,混油皮真的爱了
7322,非常不错，老客户了，他家保湿真的好，我还是容易过敏的皮肤，用他家的没事
7323,空气霜种草很久了，趁着六一八入手啦，用了两次，觉得还可以！我是油皮，用起来不觉得油腻，确实是油皮亲妈啦~~~
7324,好评 遮瑕不错 妆面哑光
7325,买一盒感觉不错，价格合理，又买了两盒
7326,睫毛膏在这家店铺买好几次了，好用，效果好，
7327,卸妆很干净，也不刺激，用完了还会再买
7328,一直都用的***牌子的东西，面膜用了觉得还不错这次果断买了很多一次性买了五六百的
7329,洗面奶收到的，挺好用的，味道好闻！
7330,太垃圾了，邮过来是碎的，和客服沟通不了，一再推卸责任，里面所剩无几，人家客服说没什么大不了，只是瓶盖碎了，这是我**以来最恶心的一次购物！
7331,太好了！**的**产品就是让人买的放心用的舒心！全满分好评！
7332,质量贼差，别买，用了眼镜疼
7333,整体描述：包装不错。物流快。一直用红瓶系列，感觉挺好的。买个精华试试。
7334,非常不错，超级喜欢，面膜还行，嘻嘻嘻
7335,扫码是真的
7336,包装完整，无破损，内网有弹力，不错～盒子也无瑕疵
7337,朋友安利说她用了一段时间 挺好用的  卖家真的豪啊 赠品居然这么多 爱了 期待效果  。
7338,好评好评，必须好评，还送了一块润肤皂
7339,真的很多啊哈哈，应该不错，囤货可以用好久了
7340,持妆效果很好
7341,做工还是有那么点糙，主要上脸干，整体可以的
7342,不好用还不好退。
7343,猪猪女孩的满满喜欢，太棒了呦。
7344,真的挺好用的，赠品也挺好的，看效果回购
7345,买东西送的，用了用还不错
7346,东西不错，很喜欢是我想要的！
7347,今天刚收到，物流快，打开了看看，产品一样，??
7348,垃圾游戏
7349,老客户啦，一直再用着***的东西，挺好的，送的小样也很好用
7350,还可以 轻薄不油腻，遮瑕效果不是特别好
7351,包装很好看，期待产品效果呦，第一次用这个牌子，但是是好牌子，信得过
7352,吸收情况：挺好的很好吸收，***看着就很上档次，希望会越来越好有效果哦
7353,效果不是很好
7354,特别说明：第一次买，感觉比较好用，
7355,铅是断的，无语😓
7356,效果很好，痘印淡的很快，已用三瓶，好吸收不油腻，平价又好用，无限回购！
7357,物美价廉，真心好物，推荐
7358,挺好的，又显白！
7359,很好用，还有淡淡的香味，下次还会来的
7360,用着不好
7361,是从前的味道，期待效果
7362,和以前买的不一样一点都不好用！
7363,用了很好用哦
7364,因为皮肤有点泛黄，所以买的紫色款，水润轻薄，也比较保湿。
7365,目前只用了两张，效果还看不出来，但是很服帖，超服帖!
7366,抹上去毫无油腻感，瞬间吸收，很喜欢这样的感觉，好用
7367,依旧好用
7368,超级不好看，千万别买，真的，特别显手黑，不管哪个颜色都是
7369,推荐购买，比实体店便宜，发货也快，很满意
7370,假的，味道不对，跟我之前在广州买的不一样！而且黑头也没粘出来
7371,味道太大了🤮🤮胶的味道
7372,一直用官方旗舰店的***，很好。
7373,不错一直都用这个
7374,和粉胶一起晚上用，不油
7375,囤货 还没开始用 应该还不错
7376,不错哦，特别便宜，一直在用此宝贝，值得推荐，敷完很湿润，小姐姐们赶紧抢购吧
7377,还好吧，物流很给力，快递员态度很好，就是好小一支啊，好评吧
7378,还不错，很好的，东西
7379,经济实惠不说主要是好用
7380,高级超乎想象
7381,呵呵，官方旗舰店还有假货。真是够了，用了还过敏。一颗星都不想给，防伪码都扫不出来。??
7382,包装高大上，还没用，等用了再追评吧
7383,服务很好，性价比高，很不错呦。
7384,应该是正品吧，一直用的****这款洗面奶感觉很好用，所以买个水试试
7385,面膜补水效果很好，适合秋季使用。
7386,什么玩意，客服说不明白话，也不觉得这东西有多好用，非常差
7387,很棒，买一送一，
7388,值得信赖一直在用的牌子，用完后脸上非常舒服，洗的特别彻底，有需要还会再来
7389,**商城买东西真是太方便了！送货又快！挺好用的！挺合适的！
7390,效果真的一般，连续用了三天，皮肤早上起来都是很干的，
7391,不容易上色，干巴巴的
7392,味道不错很好闻
7393,挺清爽的，不油腻，活动买的，很划算
7394,虽然是第一次买空气霜 但是用完觉得超好用 大促的时候一定会再回购的。
7395,假睫毛很漂亮，很喜欢，还没有戴，目前很满意，和图片没有色差，是很完美的呢！会继续购买的 
7396,刚收到，还没用，不过颜色挺漂亮，颜值也很好，外边粉嫩嫩的，非常少女心
7397,还没开始用呢，先好评吧！
7398,闻着就是胶水的气味，一点效果都没有还掉了块皮，要买的友情提醒下 使用效果：见图 
7399,东西收到了很好，下次还来购买，快递小哥直接送货到家
7400,s还可以吧
7401,送货速度快，**小哥服务好，九点就把我叫起来去拿快递，拿到就敷了一张面膜，水水的润润的，
7402,好大一瓶发的是新包装。非常不错，很划算。
7403,趁活动买的，送了5个小样，超划算
7404,虽然还没用 期待效果。包装真心不错  速度也快
7405,一百多，四大盒，太合适了，不求什么紧致美白的，只要补水就好~
7406,镜子超可爱很喜欢
7407,刚收到货就迫不及待的使用了下，感觉很不错
7408,上妆效果：网购最差的东西，没有之一，我真的不手残！！！扔了&hellip; 
7409,很实惠，刚收到还没用呢，用了在追评吧
7410,什么垃圾高光？色差严重 特别严重 从来没有过差评 客服也态度不好
7411,用的开心
7412,好油好油好油，不值得推荐
7413,宝贝特别好  特别喜欢
7414,买给妈妈的，不错哦
7415,面膜蛮轻薄的，也很服帖，透气性比较好，才刚用，还没看出效果，水分还可以，总体满意，大品牌让人放心！
7416,物流很快还是那个味道  正装一如既往的好送的比之前的少了点  寄保质期也比较近了&hellip;和上次买的是同一批次时间😅😅
7417,味道真好闻，想吃，本人混油皮用起来也不油腻，坚持使用期待效果
7418,一般般吧 不是很好，粉不够细腻，粉扑还会沾到，不是很满意
7419,这已经是第三瓶了，以前没在**买过，后来都是从**买的，用着还可以，这个还没用，用了看效果追加
7420,洗面奶很温和，清理力也强，值得推荐
7421,不好用，遮瑕效果不好，比较干，不保湿
7422,真的不知道怎么说，虽然很迷你，但是这个效果真的不知道怎么说
7423,送给妈妈的母亲节礼物，活动价格很优惠还送了一些赠品，性价比很高了
7424,超级好用，买买买
7425,闻起来味道不错
7426,送2个替换装，很超值
7427,快寄很给力，一共是两瓶，小的不知道是不是送的
7428,双十一屯的货，总体来说便宜了很多，很开心?( ? )?
7429,便宜，还锋利，比饰品店买的便宜多了，问题是好用，喜欢就买吧，大力推荐哦
7430,这个跟实物的颜色一点都不符，失望，差评，上面白白的是什么鬼
7431,这个卸妆水很不错呀，并且买300ml的卸妆水，给了160ml的赠品卸妆水，赞！
7432,清润型，用起来很清爽不油
7433,***靓白芯肌晶采隔离霜40ml 补水保湿面部遮瑕裸妆前乳紫色很好用
7434,东西不错  值得拥有
7435,老客户了，每次做活动都会买一点，做活动价钱很划算
7436,清洁能力：感觉还行，泡沫不会太多，容易清洁，洗完脸不会很干！忘记拍照了！
7437,超好用的的防晒活动力度也挺大
7438,因为***了解到***品牌，真的很不错，面膜很好用，乳液也很适合我，会回购的
7439,特别好，第二次回购了，真的变白很多。我妈50+干皮用，我20+混油皮用都ok~
7440,白天出了好多汗，下午下班回来还是白白的，满意！
7441,一直是****的忠实粉丝，这次参加活动送了好多小样哦，好开心
7442,货收到了，看起来挺好的，用了9再来评价，还送了好多东西
7443,一般吧 刚拿到的时候包装还不好 然后第一次用 用完的时候脸有点痒痒的 毕竟便宜吧 性比价嘛
7444,清洁能力：洗完脸部很清爽没有紧绷，在配合***一起用非常不错。
7445,包装捡漏也不送个盒子
7446,面膜非常好保湿效果很好，用了好多次，不过敏温和，正品
7447,建议不要买，欺骗客人，指甲油味道超级难闻，还有那个底油是粉色太难看了，人家都是透明色
7448,用了四年的***，所以想换换牌子，味道清淡水的泡沫也很细腻，就是一个小样都没有，这要是过敏怎么退啊！
7449,为了和***配套买的，感觉好贵哦，一大瓶，还没有用
7450,可以的很温和不敏感好评
7451,面膜用了才来评价的，精华液多，用后皮肤滋润。挺好的宝贝，是真品。
7452,用着脸疼
7453,根本就修不了眉，刀片太钝了，几块钱买回来个垃圾，大家千万别买了，买回来也得扔掉。
7454,巴掌大小吧，主要是质量好就行
7455,感觉有点干，总体还可以，值得购买
7456,收到用了几天，洗面奶清洗很干净，温和不刺激，脸也不紧绷，保湿效果很好。
7457,双十一买的乳液，物流很快，包装无破损，确认过眼神，是我想要的????????
7458,还不错，还可以
7459,客服绚子非常耐心的解答我的问题，提示我可以办vip积分，怎么使用化妆水，很好的客服呢
7460,混合肤质，真的不油，啦啦啦啦啦啦啦啦啦啦啦
7461,挺好的，东西收到了，快递速度快，给你们点个赞。
7462,我很喜欢，我觉得非常喜欢，并且质量特别好保障也很高，所以特别喜欢！
7463,宝贝已收到了！！效果很好
7464,很好用，奶思
7465,做活动价格还是比较优惠，赠品也多，到货很快，没用过，但愿适合自己！
7466,芳芳很好 非常好 相当好 给芳芳加钱
7467,一直支持、物流也快
7468,面膜精华液量非常足，保湿效果棒棒哒，非常适合干燥的春季使用
7469,适合肤质：好用～
7470,还不错，稍有些粘腻
7471,很好，一直用这个牌子的
7472,颜色不符  画出来怎么是绿色  真服了
7473,买了好多好多送给婆婆，她很喜欢
7474,挺锋利的，以后需要还会过来的
7475,打开很喜欢，味道闻着很淡，送了许多小礼物，谢谢店家这么用心，下次还会光顾
7476,宝贝质量很好，发货速度很快
7477,差了一下，好像是正品哦，送了很多赠品给我。还没有用过，等用过之后再来评价。
7478,吸收情况：乳液我好像用着不太吸收。
7479,520老婆很满意，她满意就是我最大的幸福
7480,面膜很不错
7481,**送货超级快！还没用！是正品！以后还会购买的！
7482,控油效果真的很好，涂上去马上就是哑光的了，太好了，不会粘腻，很舒服。早上起来保湿效果不错
7483,感觉挺好用的，洗完后不紧绷
7484,不错，很好，已经在用了
7485,很喜欢满意
7486,这次做活动挺划得来的～40g小小一只，质地轻薄好推开～无味道哦！物流速度也非常快！
7487,一般般、不太自然
7488,非常好用的隔离  以后就认准这款了
7489,好用不油腻，价格实惠
7490,收到货了卖家也赠送了很多礼品，试用了两天，总体感觉还行，效果还是没那么快出来的，坚持使用吧啊宝宝们！一起美美的！！！祝卖家生意兴隆！业绩蒸蒸日上！
7491,很好用，效果不错，还有很多赠品，这个价格不贵，卖家服务态度很不错，
7492,质量不错，，自带镜子，很清晰，中间有隔网，方便！
7493,用了一下，还可以吧
7494,一个眼睛上了睫毛膏，一个没上，是不是很明显啊，喜欢的可以网购，太便宜了。偶尔玩玩
7495,送的洗面奶也太大支了吧，超级实惠。而且很好吸收
7496,用了雪山茶的很好用第二天出油很少但是其他的就感觉像是存货一样
7497,很好用，经常买，网购优惠大一些。
7498,很划算 吸收很快 效果现在暂时评价不了
7499,回购第二个啦无印良品家睫毛夹真的巨实用
7500,东西收到了，质量不错是正品，比实体店便宜多了。
7501,面膜面积太小！
7502,都很漂亮
7503,感觉不错呢
7504,刚收到就断了&hellip;
7505,很香，用了两次才来评价，抹了头发以后不毛燥很顺滑，用完了继续来买～
7506,不错，洗脸特干净，泡沫丰富细腻
7507,拍了2组整整4大盒 够用一阵子了 喜欢***相信小罗的代言
7508,不错，超级好用的
7509,很划算的啦 还送了赠品
7510,封面太差，里面的颜色不好看，一分钱一分货
7511,宝贝收到了，这个牌子很喜欢，不贵好用的牌子，我一直用它，希望和以前买的一样好用！
7512,第二次购买了 一如既往的好 喜欢喜欢喜欢喜欢喜欢喜欢 啦啦啦啦啦啦啦啦啦啦啦啦啦啦啦啦啦啦啦啦啦
7513,温和还可以 清洁能力：，清洁的干净不干
7514,涂在脸上不油腻，吸收很快。很好。
7515,"原先在实体店买的，他家面膜超级好用，补水效果特别好，，领了劵买的平均一片才2块8,可以说是超级实惠了，好评"
7516,还可以吧，擦完乳霜之后，最好间隔五分钟左右的时间在擦防晒霜
7517,挺好用的，还送了很多东西，很划算
7518,赠品很多，很悲伤的是618没有抢到美白淡斑的。下次请多备货啊！！！
7519,好评非常好用实惠
7520,还可以，第一次使用，没什么过敏，比较服帖
7521,清洁效果：效果不错，值得信赖。。
7522,洗完还好，不干
7523,之前自己买过一瓶，用着还挺好，这次给妈妈买的 用过之后再来评价吧！
7524,控油效果蛮不错的，质地也很清爽，小样也送的很多
7525,一直用的这款，感觉还不错
7526,很不错，都在这家店卖了很多次了
7527,面膜很好用，用完再回购
7528,使用过这个牌子的化妆品，还可以，**配送很给力，五分好评
7529,很不错 一直用这家的面膜
7530,真品，和之前日本 台湾买回来的一样味道👍🏻 吸收快，不油腻，有活动真优惠，早知道买大支的了
7531,颜值高，携带方便，爱了(⑉&deg;з&deg;)-♡
7532,看着很大一瓶，店家发货很快，谢谢
7533,这个面膜还可以，水份很多。皮肤超好
7534,不怎么样，不怎么起泡沫，不如实体店的好用
7535,很好用很喜欢。效果挺好的，很贴皮肤用完还会买的
7536,还是不错挺好用的用着还不错
7537,还没用，不知道如何，就是收到快递拆开，好几样商品外包装都湿了，感觉十分不好
7538,太垃圾了，涂不开的像这个指甲油会影响心情做的味道又臭
7539,产品效果很好，和宣传的一样。
7540,用着舒服，补水效果也不错，价格实惠，以后还会光顾
7541,618年中大促  **直播间推荐的  赶上直播间的优惠及**上各种优惠红包  价格给力 现在每天都在用  希望有效果
7542,用着非常好。不过敏，还非常好用。真是买值了。
7543,有一股臭味
7544,挺好用的真的不脱妆  好用喜欢
7545,一如既往的支持，用了很多次。是正品，适合任何体制，不过敏，物美价廉
7546,妥妥的没毛病 再苦再累也要对得起自己这张脸
7547,买给妈妈用的，快递非常给力，产品价格做活动力度大，很便宜
7548,洗面奶感觉不怎么好用 总感觉洗不干净 比专柜要便宜 不知道是不是真的
7549,面膜非常好用，非常好用，非常好用，非常好用
7550,包装实在不走心  但是  彩妆很哈
7551,还没有使用，但是618购买的，送了好多的赠品，真的是超级合适，使用后在评价吧
7552,妈耶，这个什么东西哦，根本没法用，那个粉叫一个糙啊，不能再说了，洗脸去了
7553,好用，下次还会再来光顾的
7554,和同事凑单一块儿买的 趁着618活动 价格还是蛮好的 希望能去班吧
7555,挺漂亮的
7556,包装给满分，超级高大上，里面也很喜欢，性价比高
7557,洗面奶洗脸之后有一点痒！
7558,给妈妈买的 第二瓶了 她挺喜欢的
7559,好吸收，活动时购买划算。
7560,刚收到还没用，送的赠品很划算，发货速度也很快
7561,快递小个很是给力，手机没有电了，还在那里等我来拿货，**快递就是好，下次还会回购的哦?。
7562,保湿效果挺好的，而且还不化妆，是正品，下次还会光顾
7563,补水应该还是可以的，但是我是油性皮肤用起来有些油，我个人建议油性皮肤的朋友不要购买。
7564,"用了,不快&amp;#39;&amp;#39;"
7565,很好，以后还会购买
7566,昨天下单，今天上午就收到了，买时以为是33片，收到实际是40片，好惊喜，抽空敷一片，期待效果。
7567,很适合夏天用，不油，满意。
7568,非常好用，很薄很帖
7569,包装有点不好  被挤压了  不知道好不好用  用了再来追评
7570,趁活动囤的 冬天的面膜用的超费 不多长时间 面膜见底了
7571,很不满意。乱七八糟
7572,对于我来说一般般
7573,效果很好，撕完后残留的胶有一点点难弄掉，不过很好用
7574,很润。喜欢，和BB霜很搭。
7575,还算是不错的，虽然有一点点干。但是对敏感肌来说这已经很好了！
7576,今天收到，老婆拆开冼了一次很好，用完下次再来买，
7577,还不错，睫毛短也不是很夹肉，只是感觉弹簧有些松，胜在比较便宜
7578,有泡沫，而且特别温和。还有淡淡的香味。
7579,比柜台卖的便宜，又送挺多小样
7580,收到货当天晚上就用了，一点效果都没有。
7581,感觉有点稀，不如我在店里买的别的牌子洗的干净，不过，价格确实便宜
7582,简直神仙颜色  炒鸡好看！！！
7583,吸收情况：易吸收，皮肤不油腻
7584,物流很顺畅，很快，仔细研究成分后入手，期待用后的效果。
7585,给我妈妈买的，很喜欢
7586,还可以吧，手残党
7587,一打开就是坏的
7588,面膜用着还可以。
7589,快递速度很快，还没用，包装看起来不错
7590,帮同事购买的，同事用了一片，说还不错哟，叫我赶紧也买来用用。。。。
7591,收到啦，赠品的包装也挺精致的。买给老妈的，然后自己也用了小样，感觉挺不错的。
7592,发货快，客服态度好，正在用，感觉效果还是蛮好的，还送了好多小东西，满意
7593,很好，不过敏，很保湿，不油腻。
7594,常用这款，好用
7595,不好用，一点也不好用
7596,非常好的 容易打开  不错
7597,试了试很好用，希望检查用会有好的效果～谢谢卖家还送了那么多礼品
7598,超级难用，烤四五分钟都不带干的，一碰就掉
7599,个人情况：太干了 整体描述：有点小，30ml 上妆效果：一般 持久情况：四五个小时吧 适合肤质：油性
7600,气垫很不错，不浮粉，不跑妆
7601,之前买过，很好用
