id,Reviews
10675,老牌子效果就是好，推荐给朋友了
10676,瓶子设计很有质感，之前用也不油腻，赶上活动，囤货
10677,个人情况：20  偶尔化妆 整体描述：好用 上妆效果：好用 亲肤 持久情况：不油 适合肤质：痘印肌肤
10678,很好很补水，
10679,棒 用了头发顺顺
10680,用了几次还可以
10681,没用呢还  应该还不错  以前用过室友的
10682,直接就丢掉了，垃圾
10683,差评，一定不要买，十几元竟然也能假货，真的没良心，恶心的商家
10684,第二次买了 很好用
10685,感觉包装就没封口，随时可以替换一样。不会**买这类产品，操控不严，买者慎重。
10686,查了一下是正品，试用了挺好用的，下次会回购的
10687,味道太重了。毕竟便宜没好货。算了，
10688,用了一段时间以后才来评价，挺好用的。擦在脸上很细腻。而且遮瑕效果挺好。
10689,第一次用这款，感觉还可以，评论说服帖
10690,非常好，买一送一，很划算。感谢商家
10691,一般吧，没有感觉有多好用
10692,好用好用
10693,颜色还差不多但是没有照片里面的好看 感觉质量不是很好像过期了那种
10694,使用效果：使用后感觉皮肤非常舒服
10695,朋友介绍过来的说是很好用，于是自己就入手了，洗完脸特别清爽，非常舒服，还有淡淡的香味，喜欢
10696,这款宝贝我还没用过，这是第一次购买，听朋友们说是蛮好的。
10697,买一瓶送一堆，真的挺好用的，
10698,一直在用这个牌子的护肤品，非常不错
10699,***一直在用的品牌，用这很好呦！用上很服帖，没有浮粉的迹象。
10700,很满意，618价格很划算，发货速度也很快
10701,东西用了一段时间了，效果不错是正品！刚开始还担心没有实体店里的可靠
10702,618买的 买一送一 相当于有80g 算起来很划算噢
10703,在手上试了下  面霜质感很绵密 但是涂开之后确实很有空气感 一点不油 也很保湿
10704,宝贝很好用，用过后皮肤很细腻，毛孔也变小了。
10705,一直信赖**，发货和送货速度都很快，快递小哥也很好，以后还是**
10706,618活动买的，很划算，物美价廉。
10707,东西超级垃圾不看备注，
10708,正品，用***六七年了，很不错，你家的忠实粉丝哟！
10709,赠品不少
10710,用了觉得挺柔和的，不刺激，但是不怎么建议油性皮肤的小伙伴用噢
10711,颜色很棒了 但是还是手残 我没有隐藏什么 就是刚碰花的小指甲
10712,一直有回购，然后真的会白哦
10713,好用，正好有活动买一送一，滋润保湿，有增白的感觉
10714,看起来不错，还没用，不过才买两天就降价10元。真的好郁闷?
10715,物流太慢，还不知道效果怎么样
10716,面膜很好用补水效果很好每天都用，还送了个盒子
10717,上次买了水跟霜还蛮好用的是正品，这次还没用，用过再来追评吧。
10718,**一贯的速度，快又好！很不错，棒棒哒！
10719,小巧方便携带，不会漏粉扣得紧。很好
10720,我是***专业户，品牌值得信赖，**值得信赖，产品物流都给力。
10721,在手上试了一下，补水不错，有提亮的效果
10722,买给老妈的，活动价格还不错，够用很久了。
10723,东西挺好的，一共两个替换装，买的值，用着也好
10724,一直在用***的护肤品，真心不错，还送了�妆水和化妆蛋
10725,没有酒精味，用着很安心
10726,色差相差很大！！
10727,差 差 差 质量太差从来没买过这么差的睫毛膏
10728,一般，感觉脸上洗不干净
10729,什么东西，简直是垃圾，不说涂完有蝇子腿，脱妆眼圈黑乎乎的
10730,控油效果没话说，比**的好用多了。
10731,还可以用着还不错。准备化妆品用完以后也换成***的
10732,和想象中的不一样
10733,一看见色盘就失望了，颜色看起来很劣质，上妆效果也不怎么样
10734,东西都碎了！
10735,挺大一瓶的，按压式的，卸妆效果也还好。但肯定没有水油的那种效果好，这个清爽不油腻。
10736,上脸效果超级好奥
10737,不好刮眉
10738,可以 很好用 下次还会买的！
10739,第二次购买，第一次好评，第二次时间太久了，订货第二三天才发货！
10740,收到了，买了好多，和姐妹们一起买的，都说好
10741,单买都比买套装便宜，坑
10742,之前就用过了，感觉非常不错，实惠
10743,非常好 好几次购买了！！！！！非常棒补水  皮肤变得好多了
10744,这次真买对了。特别喜欢，贴在脸上。凉凉的特别舒服。不刺激皮肤。**我会信赖到老了??
10745,二次回购，从此以后离不开这款洗面奶了，温和洗后不紧绷是最大的好处啦
10746,个人情况：这个色号没我白哈哈哈哈然后遮瑕能力不错
10747,一直用这款油油，非常好用。
10748,价格便宜还包邮，用来洗脸皂起泡，挺好用的
10749,面膜纸很薄，很舒服，水分吸收很快就干了，日常补水面膜使用挺好，很清爽！
10750,很温和  补水效果棒棒哒
10751,用完皮肤状态很稳定，有提亮的效果，吸收很好，不油腻
10752,一般般，还可以，价格不算贵！用起来一般般啦
10753,物流快！包装好！
10754,适合肤质：他妈的居然又断了，服了 
10755,还没用，跟风买的，对敏感肌肤友好就行
10756,昨天晚上看到的这款面膜，随机就买了，不知道好不好用。但物流特别快。好评
10757,基本上还是蛮好用的，推开时遇到了点困难，要好好弄一弄
10758,东西是好东西，一直在用，效果很好，客服真的忙，问一下能不能优惠一点，半天不带理你的，全程机器人聊天
10759,个人情况：就很一般吧也没有说的那么好 油漆味道严重不推荐购买 
10760,很好，非常喜欢，下次还会继续买他们的产品，**直营，准没错
10761,挺好使的，泡沫很多，第二次买了。
10762,一直都在用这个，提亮效果非常
10763,还可以吧，618买一送一，划算。
10764,整体描述：涂上第一天还行，第二天开始掉了，太不持久了，这个价格就这吧 
10765,昨天下的单，今天就到了，快递很给力！
10766,****洗面奶真的超级超级好用，洗的好干净～化妆水很清爽，夏天拍在脸上很舒服～618赠品很多还额外给了起泡网，持续回购！
10767,东西还没用，但**速度真无敌了
10768,回购多次的老用户了，非常满意，很好用
10769,很滋润，双十一囤货。
10770,性价比确实很高，会回购
10771,用的还行，比较方便
10772,太值了😍😍😍本来以为买贵了，结果用了以后确实很不错啊，哈哈哈哈哈哈哈。大爱无疆了
10773,刀片质量不行啊
10774,宝贝很好，一直买，价廉物美
10775,味道特别重  不容易干
10776,好推荐购买
10777,超好用的，而且非常补水，保湿效果很好
10778,最好用的粉底没有之一！
10779,宝贝是朋友推荐的，用了一次，感觉不错，听补水的，喜欢！种草！
10780,跟描述一样，搞活动，很实惠！
10781,挺好的，按照图片买了个套餐，几个色都满意
10782,关注几年的店铺了，质量杠杠滴。
10783,用了两瓶了，效果不错，斑点很淡了
10784,非常好，很喜欢
10785,第一次用***的产品 感觉很保湿 我是油性皮肤感觉有点油 但是不提亮肤色 用了一星期出闲鱼
10786,一直用这牌子，好用。
10787,刚用开小样，这款小白精华是第一次用，看评价还不错，买来试试，效果好的话会回购的
10788,一直都是用的这款面膜纸，好用
10789,是正品，吸收也特别好一点也不油腻，保湿效果很好，值得购买。
10790,有够垃圾的不知道哪来的好评，谁买谁后悔 涂不均匀一样也不会干 一扣就掉，全丢了垃圾
10791,洗面奶很好用，洗得很干净，很清爽，送的赠品也很好。
10792,宝贝收到了，非常喜欢，还送了一块肥皂了，特别开心🥳
10793,个人情况：混合性肌肤 整体描述：还行 滋润及保湿：保湿感觉差一些，有点干 吸收情况：属亚光，吸收还好
10794,很好用！放心购买！
10795,二次购买了，挺划算的，不错！ 
10796,一直用这款，保湿补水效果不错
10797,一直用这个款的隔离，不错哦，很自然又很好推开
10798,味道好闻，就是，好少啊。。。
10799,我糖代言的肯定好用，之前买了素颜霜和隔离感觉挺好的，这次洁面买一送一划算就囤了，还没用，用了以后追评
10800,挺实用的，不心疼
10801,挺好的，遮瑕的效果也特别好，特别喜欢，物流也特别快
10802,还行吧！还挺香的，希望下次我买了不要降价
10803,搞活动买的 炒鸡合适 99片花了130 **真给力
10804,买过好几个了，很好用，敏感肌肤也没问题的
10805,还行吧 对我来说有点干 不知道为什么其他都还行的
10806,不错很好用～
10807,味道很好闻， 干爽不油腻  棒棒哒
10808,就是个次品
10809,包装的很好，还没开始用，希望好用
10810,一直用这个牌子不错不错啊！
10811,好用，还带替换装很划算?
10812,快递速度真快
10813,产品还不错有淡淡的香味而且还有小样送，**配送人员服务态度好
10814,挺水润的，上脸很服帖
10815,货真价实  以前从来不会在网上买化妆品  这个很放心
10816,还会回购的一款双眼皮贴，很自然
10817,还没用，用了上次买化妆品送的，感觉还可以，就购买了
10818,产品先不讨论，就这送的小礼物，就足够惊喜，很好用
10819,是正品，和在专柜买的一模一样。还有优惠，很划算。
10820,好用，推荐买，我是混合皮
10821,很不错，很喜欢
10822,蛮好的，划算
10823,618活动买的送了很多小样蛮划算的，透明的像凝露一样，美白效果用后追评
10824,容易刮伤
10825,上妆效果：我是大油田，上脸是哑光感，对着电脑可以维持一上午，感觉棒棒哒
10826,洗了效果很好洗了很干净很温和物流很给力
10827,不错，东西很好，很不错的一次购物体验
10828,价格实惠，物流快
10829,刚收到，有点小惊喜，三个饼，很满意
10830,物流快速，卖家人特别好，商品特别漂亮，物美价廉。
10831,面膜还没用，不过看着挺好的，如果好用的话，下次还来
10832,胶没有味，很好用
10833,洗了脸养
10834,双眼皮贴第二次买了，很隐形，用完了还会买的！
10835,水总体来说还是不错的，很清爽的样子，不油腻
10836,宝贝太好了一直都用这个牌子，超级好用，感谢卖家送的好多东西
10837,希望大家千万别买这个面膜，用着都掉皮，怕是脸都能让这个面膜给毁了，太吓人了，?
10838,这个根本不是八杯水，假货，甚拍
10839,还可以，味道有种似曾相识
10840,面膜很好用的，是正品哦，要买的姐妹们赶快行动吧
10841,特意用了几天才来评价，是正品，好用，而且比实体店便宜好多，以后会多多回购的
10842,包裹有点压坏了，不过总体还好
10843,很显白，用着感觉还挺好
10844,洗面奶是正品，一直用这家的，比商超优惠。
10845,飞粉太严重 一点都不好
10846,颜色好看，服务态度很好。物流快速。希望好用，下次再买。。。
10847,清洁能力：温和清洗干净！第二瓶
10848,味道太大，价格便宜的还是不要尝试了
10849,已用，白的比黑的好用些，给朋友送了一包反映也不错
10850,****质量有保证，效率服务都很满意，老婆很喜欢这款面膜.
10851,感觉还不错  挺香的  泡面不是很丰富  也挺好  洗好之后  脸也不干燥
10852,有点过敏
10853,比我想象中的还好，涂上很漂亮，显得手很修长。朋友叫我帮她也买两瓶。
10854,用着是很温和的一款卸妆水。可以用来卸眼妆，用完后也不油腻，用着很不错。保湿效果很好。不错，值得购买
10855,挺好用的 装的挺多的 值得购买
10856,脸上难受
10857,泡泡比较丰富。
10858,还不错，买给妈妈用的
10859,个人情况：混油皮 吸收情况：吸收挺好，不油腻 整体描述：挺喜欢的
10860,香味特别好闻
10861,洗面奶不错
10862,回购，一直在用的，很好
10863,浮粉特别厉害
10864,大牌子，用着不错，感觉比其他面膜要薄点，唯一要吐槽的是这个包装忒简单了，好歹弄个盒子三
10865,很好用，味道也好闻，一直用的爱茉莉
10866,挺不错的一款面膜，味道清香，补水的效果用过一段时间才知道
10867,一打开有两股味，香中带着难闻的气味，不好用，贴了两分钟就拿掉了，没人鱼的好用
10868,买给妈妈的，她说不错
10869,宝贝收到，非常喜欢
10870,收到了，惊喜满满，同时也还买了他们家的洗面奶，面膜很不错，是正品喔，可以放心购买
10871,有点刺激皮肤，其它还好
10872,什么眉笔啊送的眉笔一下就断了 还没用着 眉贴也不好用 不好看
10873,一直用这个牌子，送货飞快，还送了好多片，真是意外惊喜！
10874,货已收到了，物流服务好，质量很好
10875,宝贝用起来很好哦，要是瓶子能重新设计一下就好了，不好挤出来。
10876,第一次用蜡纸脱毛，还是好用的，比脱毛膏强，脱了两个腿和腋下，才用了三张，经济实惠，哈哈
10877,试了一下挺好用的，效果还不错，皮肤感觉不刺激，用段时间在追评。
10878,不油非常好👍
10879,同学说特别好用，感觉还不错然后就买了十瓶，本来3.5一瓶，结果买完就6.4涨价涨得也太快了吧！！！而且快递送的还不是我填的地方害我跑了好远才找到
10880,哑光，直接用手也好推开，挺服帖的。自己肤色有点暗黄，买的102确实有点偏粉，不知道103会不会更合适🙃
10881,敏感肌可用，很亲和，很好用！
10882,拿到手第一感觉是很小一只，我是干皮，操作简单，易推开，好吸收，不油腻，期待效果中！
10883,凑单买的，没开封，希望味道别太香
10884,非常好！！！！
10885,之前冬天用过别的系列的，现在夏天买套清爽的，送了一套面膜，喜欢他们家的包装
10886,一直用，感觉不错，赞一个
10887,防晒效果：防晒效果挺好的
10888,质量不错 服务态度好 花花
10889,很不错，老顾客了，买了好几样，这个是囤货的，用着很好
10890,最近一直在用，感觉还不错。
10891,味道有点上头不显色
10892,粉扑设计的非常棒，盒子颜值很高。用了再来追评。
10893,"不错，很大一箱子,超实惠"
10894,东西很不错，用了之后明显皮肤变好了，女友很喜欢
10895,以前都在实体店买，比较一下还是比较满意，比店里便宜多了
10896,忠实粉，好用的不要不要的，双12又入手了很多，很开心，家里的一大堆了
10897,洗面奶很温和而且外观很精美
10898,很好用，不干，提亮肤色。
10899,效果还不错，朋友推荐的，价格也很划算！很好的一次购物
10900,物流很给力
10901,宝贝收到了，我早晨下的单，下午就收到了，太给力了，而且特别好闻喜欢
10902,等了几天才发货  一打开好大一股指甲油的气味  不好闻
10903,这款面膜我一直再用挺好的值得购买
10904,挺好用的，之前朋友卖过，用的挺好的，所以这次我也买了***的
10905,一般般，感觉有点少，很干
10906,快递第二天就到了
10907,看中很久，打开试用下，刚开始凉爽的感觉，到后面很服帖，很好用，脸上不油腻，很快吸收
10908,不错的呢送了很多小东西，喜欢了，用了再来评价
10909,十分可爱了 双面镜
10910,一点都不好用，感觉跟洗衣粉一样！
10911,淡淡的香味，水润不干燥，还送了面膜和卸妆水！
10912,个人情况：不好 
10913,粉扑有一点点味道 不好闻
10914,第一次买 试了一下 很舒服 清爽 好吸收 棒
10915,好用不厚也不过敏
10916,产品质量好，价格实惠，大品牌值得信赖
10917,一点都不好看太假了
10918,不记得第几次在这家店铺买 客服态度还是很好的 东西也不错 就是有时候库房发货会有一点点忙 检查不细心
10919,挺锋利的，不错
10920,破烂包装。。。。。。。。。虽说买一送一。。。
10921,不油腻，挺清爽的。
10922,效果不好
10923,个人情况：我是脸比较白的那种，没有感觉到有美白 吸收情况：吸收挺好的 整体描述：淡斑效果没感觉到，已经第三瓶了。 滋润及保湿：保湿还是可以
10924,包装有点差！精华液不怎么好感觉太油了
10925,用过之后再追评  之后有用一个送的体验装  感觉那个很好用
10926,还没开始用空气霜正装，多送了一个***小样，先用了***小样，蛮不错的，香味有点像洗发水，但是吸收很不错。
10927,不错，下次再来
10928,好好，用完再来，
10929,618拼单买的88块，还没有用，礼盒包装还不错
10930,买一发三，挺划算的，相信**，用完还来。
10931,很划算
10932,色差太大，
10933,还不错，下次还可以考虑，推荐各位可以考虑。
10934,非常好！一直购买，不想换
10935,东西一般，不是很好用
10936,收到了 物流很快呢 活动买的很划算哦
10937,个人认为**的东西很棒！物流也很快&hellip;支持**  望**产品的品质越来越好
10938,买了隔离霜和BB霜，现在用着还行，涂上比较自然。
10939,活动买很划算
10940,只是气味好大 很刺鼻 不像描述的那样
10941,好用 化了妆可以维持很久
10942,收到是碎的
10943,上妆效果：不错，很自然。
10944,吸收快，超级滋润，双十一活动给力!
10945,第二次购买了，效果不错，主要没有黏黏的感觉，喜欢🙂
10946,还没用，使用后再来追评。睫毛很喜欢。特别是有一款，看着很好看。不过还是得等到具体使用以后再说吧。
10947,很多次了，连赠品都没有
10948,比较轻薄，感觉不错 ，送的赠品也实用。
10949,越用越感觉是假的，敷完脸上都是胶，真**坑人
10950,很好用，已经是第二次购买了
10951,很好用，洗完脸滑滑的
10952,个人情况：不是很好 还是不要买  没有几点都生锈了。 都用不了了 
10953,到当天就使用了真的很好用
10954,一直用***化妆品，面膜用过赠品，挺好，所以买来试试，太多了，不一一展示了
10955,好用，喜欢，物美价廉，总要继续回购。
10956,这款用了好几瓶了，中间也用过其他品牌还是感觉这款比较好用
10957,买没用，两个40g很划算
10958,不好用，特别是带珠光的眼影不好上色，而且还会掉在脸色乱七八糟的
10959,就是太裸妆了。。。。。。。
10960,很好的，一直在用
10961,超薄的蚕丝面膜，很好用，效果也很好。
10962,好用 颜色漂亮
10963,一直用的面膜，赞！
10964,买给妈妈的，她说挺好用得
10965,盒子特别难打开，而且有点卡粉
10966,买来的就坏了
10967,这款面膜很好用不油腻感觉也好
10968,不搓泥，上脸还不错，可以推荐购买
10969,很不错的东西 便宜不贵
10970,觉得以这个价格买到已经很划算了，***我用起来闷痘，但是嘉宝娜不会，也不黏，很喜欢~
10971,一直用***的护肤品，个人觉得不错值得购买
10972,不好用，用完就过敏，腿上都是黏糊糊的，那张纸就是一个油纸根本擦不掉胶
10973,看着还不错物流很快等用过一后在来评价
10974,和别家买同款的，这家费用还贵过别家的，还不好上色，哎
10975,大大的一瓶卸妆水，亲肤柔和，满意！！！
10976,这次活动又囤了些。 滋润及保湿：滑滑的
10977,一直用***很好用，
10978,已经买第三瓶了，很喜欢这个清爽的感觉。
10979,用了两年这个了！非常喜欢她的味道！保湿效果很好，我很喜欢
10980,一直在用，挺好用的???
10981,回购第二次 对油皮来说很清爽  保湿的话夏天足够了
10982,特别好，一直都是**的忠实粉丝！每次都没失望过！产品质量特别好！
10983,用了还不错哦，想买的亲可以放心下单了！
10984,这个面膜是两种，一种是深海鱼润面贴膜，还有一个是深海水养面贴膜都不错
10985,用了半个月了才来评价一个字好好好，值得拥有。??
10986,泡沫细腻柔软，用着舒服～包装也很好～
10987,应该是正品挺好的
10988,颜色涂上去和照片上的不符，亮片太大
10989,之前用的他们家赠品小样还可以，买来试试，
10990,个人情况：用了两年了 无限回购 使用感特别舒服 不黏腻又保湿 自我感觉是有美白效果的
10991,就是有点香，蛮温和
10992,还行，不含酒精的东西，买贵点也是情理之中😭
10993,给妈妈买的，看着还不错
10994,还好吧，感觉好像洗完是有一点紧绷
10995,收到了宝贝，打开看了感觉质感什么都很好，物美价廉，值得购买
10996,味道太大，一般般，不会用，感觉散粉上脸一会儿就没 了
10997,不好，不值得购买
10998,看起來還不錯 還沒正式使用
10999,大家别买了杀眼镜抹上就流泪  已扔
11000,不错不错，老顾客了
11001,一直用****的东西 从上学到现在也有三四年了 绝对好评 还送了这么多小样 开心 每次出去玩带着超级方便
11002,东西很一般
11003,垃圾指甲油不值这个价钱
11004,回购了好几次了，还是一如既往地好
11005,不错喔&hellip;颜色都很正，就是我技术太差啦
11006,今天用了还不错 一点也不卡粉  挺好的 就是有点小
11007,牌子的，感觉不错，给老婆买的，效果还可以。
11008,自己买的限量版樱花款，这次给婶婶买的这个，质地蛮好的，不油腻，很容易推的开，值得购买
11009,好用！只能简单补补水！
11010,物流速度太慢了，两三天都不派送，用完很明显看到白头浮出来，效果不错
11011,好好好好，买买买，下次多买一些
11012,一直都在用这款睫毛膏，一如既往的好用
11013,面膜比较补水，蛮好的
11014,朋友推荐买的，面膜轻薄，贴在脸上舒服，很好
11015,买了几次了，这次拉着朋友一起下单，还不错
11016,挺滋润的，用了几天感觉还不错～
11017,跟我之前买的味道不一样 用了鼻子起红点
11018,暂时还没用，，以前的还没用完，试了一下感觉还行，有送一个小样乳液，味道淡淡的
11019,比较好推开，比较滋润，但是本人是油皮，还是喜欢清爽的！
11020,买一送一的活动拍的，收到货了！物美价廉，五星好评！
11021,洗完滑滑的，不起泡，不是我喜欢的样子。
11022,趁着六一八活动买了送给朋友，希望美白淡斑效果好呀，看起来东西还不错，具体效果用了再说
11023,面膜不错，用着挺好的
11024,帽子质量很差，绳子穿不了，没洞
11025,镜子收到了，是个不错的小东西，真的是物美价廉
11026,用着还不错，买的紫色那个，性价比算高，眼下看可能会回购
11027,很久之前就想买了，一直听说很好用，用了几天才评价的，确实不错，吸收很好，以后还会回购的！
11028,不好用，有点胶味
11029,滋润及保湿：很滋润 个人情况：好 整体描述：香香的  很滋润 不油
11030,有种淡淡的清香，还可以，
11031,还可以颜值包装都很好，喜欢爱了爱了不过就是香精味太严重了，介意的慎拍
11032,快递态度极差，东西还没用
11033,收的 已经用了一些，感觉不错 用完继续
11034,一直在用，都是在**上买的！很好，速度很快
11035,东西是正品，买了两支，但因为家里囤的防晒霜实在太多，要的可以联系我，便宜出一支。闲🐟号是蓓蓓jennifer。
11036,买一送一 很划算哦 先囤着
11037,感觉还用，还可以开始用
11038,这个价钱真是超级值得，赠品好有分量，很好用，易吸收，推荐！
11039,没什么特别
11040,买过好几次了，用着不错
11041,活动价69元两盒入手，真的是太超值啦，很服帖，很补水，味道也喜欢
11042,原本是买来给学生化妆用的，同事先试用了一个之后，决定自用。说明使用感不错
11043,东西收到了，很好，贴肤，不卡粉
11044,没有胶水，质量不好
11045,非常，非常，真的非常的好用。我一个大油皮，感动的简直跳起来
11046,还可以吧，一直再用这款
11047,母亲节给妈妈的礼物，她很喜欢，她是一直用这个牌子的化妆品，一直在专柜买的，希望这次她也能用的开心
11048,收货很快，还送了一个替换装，不错?
11049,物流很快 包装得很漂亮  很满意  用起来一点也不起皮用完在回购
11050,好用，用完皮肤滑滑的，保湿效果很好
11051,不太好开
11052,我头一次用这个牌子，用的挺好的，不是那种油腻腻的，洁肤很好，用好了下次还来买。
11053,很不错满满两大盒买一送一很划算
11054,挺润的，至少不起干皮。
11055,收到了，不错，是正品，和卖家描述的一样，继续使用，效果明显，推荐购买
11056,刚用觉着还不错，看看后面怎么样吧
11057,效果太不好了
